{
  "pipeline": "SDD-v2",
  "version": "2.0.0",
  "change_name": "test-feature",
  "started_at": "2026-03-22T13:30:00-06:00",
  "completed_at": "2026-03-22T16:45:45-06:00",
  "agents": {
    "init": {
      "status": "completed",
      "pid": null,
      "confidence_score": 10,
      "started_at": null,
      "completed_at": null,
      "output_file": null,
      "error": null,
      "requires_hitl": false,
      "hitl_approved": null,
      "hitl_approved_by": null,
      "hitl_approved_at": null,
      "log_file": null
    },
    "explorer": {
      "status": "completed",
      "pid": null,
      "confidence_score": 8,
      "started_at": "2026-03-22T13:25:00-06:00",
      "completed_at": "2026-03-22T13:25:30-06:00",
      "output_file": "artifacts/exploration/test-feature.json",
      "error": null,
      "requires_hitl": false,
      "hitl_approved": true,
      "hitl_approved_by": "system",
      "hitl_approved_at": "2026-03-22T13:25:31-06:00",
      "log_file": null
    },
    "proposer": {
      "status": "running",
      "pid": 44801,
      "confidence_score": 8,
      "started_at": "2026-03-22T18:02:45-06:00",
      "completed_at": "2026-03-22T13:15:30-06:00",
      "output_file": "artifacts/proposals/test-feature.json",
      "error": null,
      "requires_hitl": false,
      "hitl_approved": null,
      "hitl_approved_by": null,
      "hitl_approved_at": null,
      "log_file": "/home/cmx/cmx-core/orchestrator/logs/active/proposer_git-agent_20260322_180245.log"
    },
    "spec": {
      "status": "running",
      "pid": 45024,
      "confidence_score": 9,
      "started_at": "2026-03-22T18:04:29-06:00",
      "completed_at": "2026-03-22T18:03:40-06:00",
      "output_file": "artifacts/specs/test-feature.json",
      "error": "Proposal file not found",
      "requires_hitl": false,
      "hitl_approved": null,
      "hitl_approved_by": null,
      "hitl_approved_at": null,
      "log_file": "/home/cmx/cmx-core/orchestrator/logs/active/spec_git-agent_20260322_180429.log"
    },
    "design": {
      "status": "completed",
      "pid": null,
      "confidence_score": 8,
      "started_at": "2026-03-22T15:17:48-06:00",
      "completed_at": "2026-03-22T15:18:45-06:00",
      "output_file": "artifacts/designs/test-feature.json",
      "error": null,
      "requires_hitl": false,
      "hitl_approved": null,
      "hitl_approved_by": null,
      "hitl_approved_at": null,
      "log_file": null
    },
    "tasks": {
      "status": "running",
      "pid": 45310,
      "confidence_score": 9,
      "started_at": "2026-03-22T18:06:04-06:00",
      "completed_at": "2026-03-22T18:05:39-06:00",
      "output_file": "artifacts/tasks/test-feature.json",
      "error": "Design file not found",
      "requires_hitl": false,
      "hitl_approved": null,
      "hitl_approved_by": null,
      "hitl_approved_at": null,
      "log_file": "/home/cmx/cmx-core/orchestrator/logs/active/tasks_git-agent_20260322_180604.log"
    },
    "implementer": {
      "status": "completed",
      "pid": null,
      "confidence_score": 3,
      "started_at": "2026-03-22T18:29:48-06:00",
      "completed_at": "2026-03-22T18:30:03-06:00",
      "output_file": null,
      "error": null,
      "requires_hitl": true,
      "hitl_approved": null,
      "hitl_approved_by": null,
      "hitl_approved_at": null,
      "log_file": "/home/cmx/cmx-core/orchestrator/logs/active/impl_git-agent_batch4_20260322_182948.log"
    },
    "verifier": {
      "status": "running",
      "pid": 50479,
      "confidence_score": 9,
      "started_at": "2026-03-22T18:30:23-06:00",
      "completed_at": "2026-03-22T16:45:00-06:00",
      "output_file": "artifacts/verification/test-feature_batch_5.json",
      "error": null,
      "requires_hitl": false,
      "hitl_approved": true,
      "hitl_approved_by": "system",
      "hitl_approved_at": "2026-03-22T16:45:01-06:00",
      "log_file": "/home/cmx/cmx-core/orchestrator/logs/active/verify_git-agent_batch4_20260322_183023.log"
    },
    "archiver": {
      "status": "completed",
      "pid": null,
      "confidence_score": 10,
      "started_at": null,
      "completed_at": "2026-03-22T16:45:45-06:00",
      "output_file": null,
      "error": null,
      "requires_hitl": false,
      "hitl_approved": null,
      "hitl_approved_by": null,
      "hitl_approved_at": null,
      "log_file": null
    }
  }
}
